{
  "$schema": "./issuetype_schema.json",
  "key": "TASK",
  "name": "Task",
  "description": "Focused task that executes one specific thing",
  "mode": "autonomous",
  "glyph": ">",
  "color": "cyan",
  "branch_prefix": "task",
  "project_required": false,
  "fields": [
    {
      "name": "id",
      "description": "Unique ticket identifier",
      "type": "string",
      "required": true,
      "auto": "id",
      "display_order": 0,
      "user_editable": false
    },
    {
      "name": "project",
      "description": "Target project (optional)",
      "type": "string",
      "required": false,
      "default": "",
      "placeholder": "Optional project name",
      "display_order": 1
    },
    {
      "name": "priority",
      "description": "Ticket priority level",
      "type": "enum",
      "required": false,
      "default": "P2-medium",
      "options": ["P0-critical", "P1-high", "P2-medium", "P3-low"],
      "display_order": 2
    },
    {
      "name": "status",
      "description": "Ticket status",
      "type": "string",
      "required": true,
      "auto": "status",
      "default": "queued",
      "display_order": 3,
      "user_editable": false
    },
    {
      "name": "created",
      "description": "Creation date",
      "type": "date",
      "required": true,
      "auto": "date",
      "display_order": 4,
      "user_editable": false
    },
    {
      "name": "summary",
      "description": "One-line description of the task",
      "type": "string",
      "required": true,
      "default": "",
      "placeholder": "Brief description of the task",
      "max_length": 120,
      "display_order": 5
    },
    {
      "name": "context",
      "description": "Background context for the task",
      "type": "text",
      "required": false,
      "default": "",
      "placeholder": "Any relevant background or constraints",
      "display_order": 6
    }
  ],
  "steps": [
    {
      "name": "execute",
      "display_name": "Executing",
      "outputs": ["code", "report"],
      "prompt": "Execute this task:\n\n1. Read the ticket summary and context\n2. Explore the codebase as needed\n3. Complete the task as specified\n4. Document what was done\n\nThis is a focused task - complete it directly without creating follow-up tickets or plans.",
      "allowed_tools": ["Read", "Write", "Edit", "Glob", "Grep", "Bash"],
      "requires_review": false
    }
  ]
}
